<?xml version="1.0" encoding="UTF-8"?>
<!-- edited with XMLSpy v2007 sp2 (http://www.altova.com) by Peter Donker (Bring2mind) -->
<templateSettings xmlns:xsi="http://www.w3.org/2001/XMLSchema-instance" xsi:noNamespaceSchemaLocation="..\Settings.xsd">
 <templateSetting>
  <key>pager</key>
  <valueType>truefalse</valueType>
  <defaultValue>false</defaultValue>
 </templateSetting>
 <templateSetting>
  <key>allow-wrap</key>
  <valueType>truefalse</valueType>
  <defaultValue>true</defaultValue>
 </templateSetting>
 <templateSetting>
  <key>auto-height</key>
  <valueType>string</valueType>
  <defaultValue>0</defaultValue>
 </templateSetting>
 <templateSetting>
  <key>delay</key>
  <valueType>integer</valueType>
  <defaultValue>0</defaultValue>
 </templateSetting>
 <templateSetting>
  <key>fx</key>
  <valueType>dropdown</valueType>
  <values>
   <value>none</value>
   <value>fade</value>
   <value>fadeout</value>
   <value>scrollHorz</value>
  </values>
  <defaultValue>fade</defaultValue>
 </templateSetting>
 <templateSetting>
  <key>loop</key>
  <valueType>integer</valueType>
  <defaultValue>0</defaultValue>
 </templateSetting>
 <templateSetting>
  <key>pause-on-hover</key>
  <valueType>truefalse</valueType>
  <defaultValue>false</defaultValue>
 </templateSetting>
 <templateSetting>
  <key>random</key>
  <valueType>truefalse</valueType>
  <defaultValue>false</defaultValue>
 </templateSetting>
 <templateSetting>
  <key>reverse</key>
  <valueType>truefalse</valueType>
  <defaultValue>false</defaultValue>
 </templateSetting>
 <templateSetting>
  <key>speed</key>
  <valueType>integer</valueType>
  <defaultValue>1000</defaultValue>
 </templateSetting>
 <templateSetting>
  <key>starting-slide</key>
  <valueType>integer</valueType>
  <defaultValue>0</defaultValue>
 </templateSetting>
 <templateSetting>
  <key>swipe</key>
  <valueType>truefalse</valueType>
  <defaultValue>false</defaultValue>
 </templateSetting>
 <templateSetting>
  <key>sync</key>
  <valueType>truefalse</valueType>
  <defaultValue>true</defaultValue>
 </templateSetting>
 <templateSetting>
  <key>timeout</key>
  <valueType>integer</valueType>
  <defaultValue>4000</defaultValue>
 </templateSetting>
 <templateSetting>
  <key>easing</key>
  <valueType>string</valueType>
  <defaultValue>null</defaultValue>
 </templateSetting>
</templateSettings>
