<?xml version="1.0" encoding="UTF-8"?>
<!-- edited with XMLSpy v2007 sp2 (http://www.altova.com) by Peter Donker (Bring2mind) -->
<templateSettings xmlns:xsi="http://www.w3.org/2001/XMLSchema-instance" xsi:noNamespaceSchemaLocation="..\Settings.xsd">
 <templateSetting>
  <key>effect</key>
  <valueType>dropdown</valueType>
  <defaultValue>random</defaultValue>
  <values>
   <value>sliceDown</value>
   <value>sliceDownLeft</value>
   <value>sliceUp</value>
   <value>sliceUpLeft</value>
   <value>sliceUpDown</value>
   <value>sliceUpDownLeft</value>
   <value>fold</value>
   <value>fade</value>
   <value>random</value>
   <value>slideInRight</value>
   <value>slideInLeft</value>
   <value>boxRandom</value>
   <value>boxRain</value>
   <value>boxRainReverse</value>
   <value>boxRainGrow</value>
   <value>boxRainGrowReverse</value>
  </values>
 </templateSetting>
 <templateSetting>
  <key>slices</key>
  <valueType>integer</valueType>
  <defaultValue>15</defaultValue>
 </templateSetting>
 <templateSetting>
  <key>boxCols</key>
  <valueType>integer</valueType>
  <defaultValue>8</defaultValue>
 </templateSetting>
 <templateSetting>
  <key>boxRows</key>
  <valueType>integer</valueType>
  <defaultValue>4</defaultValue>
 </templateSetting>
 <templateSetting>
  <key>animSpeed</key>
  <valueType>integer</valueType>
  <defaultValue>500</defaultValue>
 </templateSetting>
 <templateSetting>
  <key>pauseTime</key>
  <valueType>integer</valueType>
  <defaultValue>3000</defaultValue>
 </templateSetting>
 <templateSetting>
  <key>startSlide</key>
  <valueType>integer</valueType>
  <defaultValue>0</defaultValue>
 </templateSetting>
 <templateSetting>
  <key>directionNav</key>
  <valueType>truefalse</valueType>
  <defaultValue>true</defaultValue>
 </templateSetting>
 <templateSetting>
  <key>directionNavHide</key>
  <valueType>truefalse</valueType>
  <defaultValue>true</defaultValue>
 </templateSetting>
 <templateSetting>
  <key>controlNav</key>
  <valueType>truefalse</valueType>
  <defaultValue>true</defaultValue>
 </templateSetting>
 <templateSetting>
  <key>controlNavThumbs</key>
  <valueType>truefalse</valueType>
  <defaultValue>false</defaultValue>
 </templateSetting>
 <templateSetting>
  <key>pauseOnHover</key>
  <valueType>truefalse</valueType>
  <defaultValue>true</defaultValue>
 </templateSetting>
 <templateSetting>
  <key>manualAdvance</key>
  <valueType>truefalse</valueType>
  <defaultValue>false</defaultValue>
 </templateSetting>
 <templateSetting>
  <key>prevText</key>
  <valueType>string</valueType>
  <defaultValue>Prev</defaultValue>
 </templateSetting>
 <templateSetting>
  <key>nextText</key>
  <valueType>string</valueType>
  <defaultValue>Next</defaultValue>
 </templateSetting>
 <templateSetting>
  <key>randomStart</key>
  <valueType>truefalse</valueType>
  <defaultValue>false</defaultValue>
 </templateSetting>
</templateSettings>
