<?xml version="1.0" encoding="UTF-8"?>
<!-- edited with XMLSpy v2007 sp2 (http://www.altova.com) by Peter Donker (Bring2mind) -->
<templateSettings xmlns:xsi="http://www.w3.org/2001/XMLSchema-instance" xsi:noNamespaceSchemaLocation="..\Settings.xsd">
 <templateSetting>
  <key>auto</key>
  <valueType>truefalse</valueType>
  <defaultValue>true</defaultValue>
 </templateSetting>
 <templateSetting>
  <key>speed</key>
  <valueType>integer</valueType>
  <defaultValue>500</defaultValue>
 </templateSetting>
 <templateSetting>
  <key>timeout</key>
  <valueType>integer</valueType>
  <defaultValue>4000</defaultValue>
 </templateSetting>
 <templateSetting>
  <key>pager</key>
  <valueType>truefalse</valueType>
  <defaultValue>false</defaultValue>
 </templateSetting>
 <templateSetting>
  <key>nav</key>
  <valueType>truefalse</valueType>
  <defaultValue>false</defaultValue>
 </templateSetting>
 <templateSetting>
  <key>random</key>
  <valueType>truefalse</valueType>
  <defaultValue>false</defaultValue>
 </templateSetting>
 <templateSetting>
  <key>pause</key>
  <valueType>truefalse</valueType>
  <defaultValue>false</defaultValue>
 </templateSetting>
 <templateSetting>
  <key>pauseControls</key>
  <valueType>truefalse</valueType>
  <defaultValue>false</defaultValue>
 </templateSetting>
 <templateSetting>
  <key>prevText</key>
  <valueType>string</valueType>
  <defaultValue>Previous</defaultValue>
 </templateSetting>
 <templateSetting>
  <key>nextText</key>
  <valueType>string</valueType>
  <defaultValue>Next</defaultValue>
 </templateSetting>
 <templateSetting>
  <key>maxwidth</key>
  <valueType>string</valueType>
  <defaultValue></defaultValue>
 </templateSetting>
</templateSettings>
