<?xml version="1.0" encoding="UTF-8"?>
<!-- edited with XMLSpy v2007 sp2 (http://www.altova.com) by Peter Donker (Bring2mind) -->
<templateSettings xmlns:xsi="http://www.w3.org/2001/XMLSchema-instance" xsi:noNamespaceSchemaLocation="..\Settings.xsd">
 <templateSetting>
  <key>overlayBgColor</key>
  <valueType>string</valueType>
  <defaultValue>#000</defaultValue>
 </templateSetting>
 <templateSetting>
  <key>overlayOpacity</key>
  <valueType>integer</valueType>
  <defaultValue>8</defaultValue>
 </templateSetting>
 <templateSetting>
  <key>fixedNavigation</key>
  <valueType>truefalse</valueType>
  <defaultValue>false</defaultValue>
 </templateSetting>
 <templateSetting>
  <key>imageLoading</key>
  <valueType>string</valueType>
  <defaultValue>images/loading.gif</defaultValue>
 </templateSetting>
 <templateSetting>
  <key>imageBtnPrev</key>
  <valueType>string</valueType>
  <defaultValue>images/prev.png</defaultValue>
 </templateSetting>
 <templateSetting>
  <key>imageBtnNext</key>
  <valueType>string</valueType>
  <defaultValue>images/next.png</defaultValue>
 </templateSetting>
 <templateSetting>
  <key>imageBtnClose</key>
  <valueType>string</valueType>
  <defaultValue>images/close.png</defaultValue>
 </templateSetting>
 <templateSetting>
  <key>imageBlank</key>
  <valueType>string</valueType>
  <defaultValue>images/lightbox-blank.gif</defaultValue>
 </templateSetting>
 <templateSetting>
  <key>imageBtnBottomPrev</key>
  <valueType>string</valueType>
  <defaultValue>images/btm_prev.gif</defaultValue>
 </templateSetting>
 <templateSetting>
  <key>imageBtnBottomNext</key>
  <valueType>string</valueType>
  <defaultValue>images/btm_next.gif</defaultValue>
 </templateSetting>
 <templateSetting>
  <key>imageBtnPlay</key>
  <valueType>string</valueType>
  <defaultValue>images/start.png</defaultValue>
 </templateSetting>
 <templateSetting>
  <key>imageBtnStop</key>
  <valueType>string</valueType>
  <defaultValue>images/pause.png</defaultValue>
 </templateSetting>
 <templateSetting>
  <key>containerBorderSize</key>
  <valueType>integer</valueType>
  <defaultValue>10</defaultValue>
 </templateSetting>
 <templateSetting>
  <key>containerResizeSpeed</key>
  <valueType>integer</valueType>
  <defaultValue>500</defaultValue>
 </templateSetting>
 <templateSetting>
  <key>slideShowTimer</key>
  <valueType>integer</valueType>
  <defaultValue>5000</defaultValue>
 </templateSetting>
</templateSettings>
