<?xml version="1.0" encoding="UTF-8"?>
<!-- edited with XMLSpy v2007 sp2 (http://www.altova.com) by Peter Donker (Bring2mind) -->
<templateSettings xmlns:xsi="http://www.w3.org/2001/XMLSchema-instance" xsi:noNamespaceSchemaLocation="..\Settings.xsd">
 <templateSetting>
  <key>padding</key>
  <valueType>integer</valueType>
  <defaultValue>10</defaultValue>
 </templateSetting>
 <templateSetting>
  <key>margin</key>
  <valueType>integer</valueType>
  <defaultValue>20</defaultValue>
 </templateSetting>
 <templateSetting>
  <key>opacity</key>
  <valueType>truefalse</valueType>
  <defaultValue>false</defaultValue>
 </templateSetting>
 <templateSetting>
  <key>modal</key>
  <valueType>truefalse</valueType>
  <defaultValue>false</defaultValue>
 </templateSetting>
 <templateSetting>
  <key>cyclic</key>
  <valueType>truefalse</valueType>
  <defaultValue>false</defaultValue>
 </templateSetting>
 <templateSetting>
  <key>scrolling</key>
  <valueType>dropdown</valueType>
  <defaultValue>auto</defaultValue>
  <values>
   <value>auto</value>
   <value>yes</value>
   <value>no</value>
  </values>
 </templateSetting>
 <templateSetting>
  <key>width</key>
  <valueType>integer</valueType>
  <defaultValue>560</defaultValue>
 </templateSetting>
 <templateSetting>
  <key>height</key>
  <valueType>integer</valueType>
  <defaultValue>340</defaultValue>
 </templateSetting>
 <templateSetting>
  <key>autoScale</key>
  <valueType>truefalse</valueType>
  <defaultValue>true</defaultValue>
 </templateSetting>
 <templateSetting>
  <key>autoDimensions</key>
  <valueType>truefalse</valueType>
  <defaultValue>true</defaultValue>
 </templateSetting>
 <templateSetting>
  <key>centerOnScroll</key>
  <valueType>truefalse</valueType>
  <defaultValue>false</defaultValue>
 </templateSetting>
 <templateSetting>
  <key>swf</key>
  <valueType>string</valueType>
  <defaultValue>{wmode: 'transparent'}</defaultValue>
 </templateSetting>
 <templateSetting>
  <key>hideOnOverlayClick</key>
  <valueType>truefalse</valueType>
  <defaultValue>true</defaultValue>
 </templateSetting>
 <templateSetting>
  <key>hideOnContentClick</key>
  <valueType>truefalse</valueType>
  <defaultValue>false</defaultValue>
 </templateSetting>
 <templateSetting>
  <key>overlayShow</key>
  <valueType>truefalse</valueType>
  <defaultValue>true</defaultValue>
 </templateSetting>
 <templateSetting>
  <key>overlayOpacity</key>
  <valueType>number</valueType>
  <defaultValue>0.3</defaultValue>
 </templateSetting>
 <templateSetting>
  <key>overlayColor</key>
  <valueType>string</valueType>
  <defaultValue>#666</defaultValue>
 </templateSetting>
 <templateSetting>
  <key>titleShow</key>
  <valueType>truefalse</valueType>
  <defaultValue>true</defaultValue>
 </templateSetting>
 <templateSetting>
  <key>titlePosition</key>
  <valueType>dropdown</valueType>
  <defaultValue>float</defaultValue>
  <values>
   <value>float</value>
   <value>outside</value>
   <value>inside</value>
   <value>over</value>
  </values>
 </templateSetting>
 <templateSetting>
  <key>titleFormat</key>
  <valueType>string</valueType>
  <defaultValue>null</defaultValue>
 </templateSetting>
 <templateSetting>
  <key>transitionIn</key>
  <valueType>dropdown</valueType>
  <defaultValue>fade</defaultValue>
  <values>
   <value>fade</value>
   <value>elastic</value>
   <value>none</value>
  </values>
 </templateSetting>
 <templateSetting>
  <key>transitionOut</key>
  <valueType>dropdown</valueType>
  <defaultValue>fade</defaultValue>
  <values>
   <value>fade</value>
   <value>elastic</value>
   <value>none</value>
  </values>
 </templateSetting>
 <templateSetting>
  <key>speedIn</key>
  <valueType>integer</valueType>
  <defaultValue>300</defaultValue>
 </templateSetting>
 <templateSetting>
  <key>speedOut</key>
  <valueType>integer</valueType>
  <defaultValue>300</defaultValue>
 </templateSetting>
 <templateSetting>
  <key>changeSpeed</key>
  <valueType>integer</valueType>
  <defaultValue>300</defaultValue>
 </templateSetting>
 <templateSetting>
  <key>changeFade</key>
  <valueType>dropdown</valueType>
  <defaultValue>fast</defaultValue>
  <values>
   <value>fast</value>
   <value>slow</value>
  </values>
 </templateSetting>
 <templateSetting>
  <key>easingIn</key>
  <valueType>dropdown</valueType>
  <defaultValue>swing</defaultValue>
  <values>
   <value>swing</value>
   <value>linear</value>
  </values>
 </templateSetting>
 <templateSetting>
  <key>easingOut</key>
  <valueType>dropdown</valueType>
  <defaultValue>swing</defaultValue>
  <values>
   <value>swing</value>
   <value>linear</value>
  </values>
 </templateSetting>
 <templateSetting>
  <key>showCloseButton</key>
  <valueType>truefalse</valueType>
  <defaultValue>true</defaultValue>
 </templateSetting>
 <templateSetting>
  <key>showNavArrows</key>
  <valueType>truefalse</valueType>
  <defaultValue>true</defaultValue>
 </templateSetting>
 <templateSetting>
  <key>enableEscapeButton</key>
  <valueType>truefalse</valueType>
  <defaultValue>true</defaultValue>
 </templateSetting>
</templateSettings>
