<?xml version="1.0" encoding="UTF-8"?>
<templateSettings xmlns:xsi="http://www.w3.org/2001/XMLSchema-instance" xsi:noNamespaceSchemaLocation="..\Settings.xsd">
 <templateSetting>
  <key>effect</key>
  <valueType>dropdown</valueType>
  <values>
   <value>slide</value>
   <value>fade</value>
   <value>cube</value>
   <value>overflow</value>
  </values>
  <defaultValue>slide</defaultValue>
 </templateSetting>
 <templateSetting>
  <key>autoplay</key>
  <valueType>integer</valueType>
  <defaultValue>10000</defaultValue>
 </templateSetting>
</templateSettings>
