<?xml version="1.0" encoding="UTF-8"?>
<templateSettings xmlns:xsi="http://www.w3.org/2001/XMLSchema-instance" xsi:noNamespaceSchemaLocation="..\Settings.xsd">
 <templateSetting>
  <key>captions</key>
  <valueType>dropdown</valueType>
  <values>
   <value>overlay</value>
   <value>below</value>
   <value>custom</value>
   <value>none</value>
  </values>
  <defaultValue>overlay</defaultValue>
 </templateSetting>
 <templateSetting>
  <key>responsive</key>
  <valueType>truefalse</valueType>
  <defaultValue>true</defaultValue>
 </templateSetting>
 <templateSetting>
  <key>pager</key>
  <valueType>truefalse</valueType>
  <defaultValue>true</defaultValue>
 </templateSetting>
 <templateSetting>
  <key>controls</key>
  <valueType>truefalse</valueType>
  <defaultValue>true</defaultValue>
 </templateSetting>
 <templateSetting>
  <key>transition</key>
  <valueType>dropdown</valueType>
  <values>
   <value>fade</value>
   <value>horizontal</value>
   <value>vertical</value>
   <value>kenburns</value>
   <value>none</value>
  </values>
  <defaultValue>fade</defaultValue>
 </templateSetting>
 <templateSetting>
  <key>speed</key>
  <valueType>integer</valueType>
  <defaultValue>800</defaultValue>
 </templateSetting>
 <templateSetting>
  <key>pause</key>
  <valueType>integer</valueType>
  <defaultValue>3000</defaultValue>
 </templateSetting>
</templateSettings>
