<?xml version="1.0" encoding="UTF-8"?>
<!-- edited with XMLSpy v2007 sp2 (http://www.altova.com) by Peter Donker (Bring2mind) -->
<templateSettings xmlns:xsi="http://www.w3.org/2001/XMLSchema-instance" xsi:noNamespaceSchemaLocation="..\Settings.xsd">
 <templateSetting>
  <key>fx</key>
  <valueType>dropdown</valueType>
  <values>
   <value>none</value>
   <value>blindX</value>
   <value>blindY</value>
   <value>blindZ</value>
   <value>cover</value>
   <value>curtainX</value>
   <value>curtainY</value>
   <value>fade</value>
   <value>fadeZoom</value>
   <value>growX</value>
   <value>growY</value>
   <value>scollVert</value>
   <value>scrollDown</value>
   <value>scrollHorz</value>
   <value>scrollLeft</value>
   <value>scrollRight</value>
   <value>scrollUp</value>
   <value>shuffle</value>
   <value>slideX</value>
   <value>slideY</value>
   <value>toss</value>
   <value>turnDown</value>
   <value>turnLeft</value>
   <value>turnRight</value>
   <value>turnUp</value>
   <value>uncover</value>
   <value>wipe</value>
   <value>zoom</value>
  </values>
  <defaultValue>fade</defaultValue>
 </templateSetting>
 <templateSetting>
  <key>autostop</key>
  <valueType>10</valueType>
  <defaultValue>0</defaultValue>
 </templateSetting>
 <templateSetting>
  <key>autostopCount</key>
  <valueType>10</valueType>
  <defaultValue>0</defaultValue>
 </templateSetting>
 <templateSetting>
  <key>backwards</key>
  <valueType>truefalse</valueType>
  <defaultValue>false</defaultValue>
 </templateSetting>
 <templateSetting>
  <key>cleartypeNoBg</key>
  <valueType>truefalse</valueType>
  <defaultValue>false</defaultValue>
 </templateSetting>
 <templateSetting>
  <key>containerResize</key>
  <valueType>10</valueType>
  <defaultValue>1</defaultValue>
 </templateSetting>
 <templateSetting>
  <key>continuous</key>
  <valueType>10</valueType>
  <defaultValue>0</defaultValue>
 </templateSetting>
 <templateSetting>
  <key>delay</key>
  <valueType>integer</valueType>
  <defaultValue>0</defaultValue>
 </templateSetting>
 <templateSetting>
  <key>fastOnEvent</key>
  <valueType>integer</valueType>
  <defaultValue>0</defaultValue>
 </templateSetting>
 <templateSetting>
  <key>fit</key>
  <valueType>10</valueType>
  <defaultValue>0</defaultValue>
 </templateSetting>
 <templateSetting>
  <key>height</key>
  <valueType>string</valueType>
  <defaultValue>auto</defaultValue>
 </templateSetting>
 <templateSetting>
  <key>manualTrump</key>
  <valueType>truefalse</valueType>
  <defaultValue>true</defaultValue>
 </templateSetting>
 <templateSetting>
  <key>nowrap</key>
  <valueType>10</valueType>
  <defaultValue>0</defaultValue>
 </templateSetting>
 <templateSetting>
  <key>pause</key>
  <valueType>10</valueType>
  <defaultValue>0</defaultValue>
 </templateSetting>
 <templateSetting>
  <key>random</key>
  <valueType>10</valueType>
  <defaultValue>0</defaultValue>
 </templateSetting>
 <templateSetting>
  <key>randomizeEffects</key>
  <valueType>10</valueType>
  <defaultValue>1</defaultValue>
 </templateSetting>
 <templateSetting>
  <key>requeueOnImageNotLoaded</key>
  <valueType>truefalse</valueType>
  <defaultValue>true</defaultValue>
 </templateSetting>
 <templateSetting>
  <key>requeueTimeout</key>
  <valueType>integer</valueType>
  <defaultValue>250</defaultValue>
 </templateSetting>
 <templateSetting>
  <key>rev</key>
  <valueType>10</valueType>
  <defaultValue>0</defaultValue>
 </templateSetting>
 <templateSetting>
  <key>slideResize</key>
  <valueType>10</valueType>
  <defaultValue>1</defaultValue>
 </templateSetting>
 <templateSetting>
  <key>speed</key>
  <valueType>integer</valueType>
  <defaultValue>1000</defaultValue>
 </templateSetting>
 <templateSetting>
  <key>sync</key>
  <valueType>10</valueType>
  <defaultValue>1</defaultValue>
 </templateSetting>
 <templateSetting>
  <key>timeout</key>
  <valueType>integer</valueType>
  <defaultValue>4000</defaultValue>
 </templateSetting>
</templateSettings>
