<?xml version="1.0" encoding="UTF-8"?>
<!-- edited with XMLSpy v2007 sp2 (http://www.altova.com) by Peter Donker (Bring2mind) -->
<templateSettings xmlns:xsi="http://www.w3.org/2001/XMLSchema-instance" xsi:noNamespaceSchemaLocation="..\Settings.xsd">
 <templateSetting>
  <key>transition_speed</key>
  <valueType>integer</valueType>
  <defaultValue>1000</defaultValue>
 </templateSetting>
 <templateSetting>
  <key>transition_interval</key>
  <valueType>integer</valueType>
  <defaultValue>5000</defaultValue>
 </templateSetting>
 <templateSetting>
  <key>easing</key>
  <valueType>dropdown</valueType>
  <defaultValue>swing</defaultValue>
  <values>
   <value>swing</value>
   <value>linear</value>
  </values>
 </templateSetting>
 <templateSetting>
  <key>show_panels</key>
  <valueType>truefalse</valueType>
  <defaultValue>true</defaultValue>
 </templateSetting>
 <templateSetting>
  <key>show_panel_nav</key>
  <valueType>truefalse</valueType>
  <defaultValue>true</defaultValue>
 </templateSetting>
 <templateSetting>
  <key>enable_overlays</key>
  <valueType>truefalse</valueType>
  <defaultValue>false</defaultValue>
 </templateSetting>
 <templateSetting>
  <key>panel_width</key>
  <valueType>integer</valueType>
  <defaultValue>800</defaultValue>
 </templateSetting>
 <templateSetting>
  <key>panel_height</key>
  <valueType>integer</valueType>
  <defaultValue>400</defaultValue>
 </templateSetting>
 <templateSetting>
  <key>panel_animation</key>
  <valueType>dropdown</valueType>
  <defaultValue>fade</defaultValue>
  <values>
   <value>crossfade</value>
   <value>fade</value>
   <value>slide</value>
   <value>none</value>
  </values>
 </templateSetting>
 <templateSetting>
  <key>panel_scale</key>
  <valueType>dropdown</valueType>
  <defaultValue>crop</defaultValue>
  <values>
   <value>crop</value>
   <value>fit</value>
  </values>
 </templateSetting>
 <templateSetting>
  <key>overlay_position</key>
  <valueType>dropdown</valueType>
  <defaultValue>bottom</defaultValue>
  <values>
   <value>bottom</value>
   <value>top</value>
  </values>
 </templateSetting>
 <templateSetting>
  <key>pan_images</key>
  <valueType>truefalse</valueType>
  <defaultValue>false</defaultValue>
 </templateSetting>
 <templateSetting>
  <key>pan_style</key>
  <valueType>dropdown</valueType>
  <defaultValue>drag</defaultValue>
  <values>
   <value>drag</value>
   <value>track</value>
  </values>
 </templateSetting>
 <templateSetting>
  <key>pan_smoothness</key>
  <valueType>integer</valueType>
  <defaultValue>15</defaultValue>
 </templateSetting>
 <templateSetting>
  <key>start_frame</key>
  <valueType>integer</valueType>
  <defaultValue>1</defaultValue>
 </templateSetting>
 <templateSetting>
  <key>show_filmstrip</key>
  <valueType>truefalse</valueType>
  <defaultValue>true</defaultValue>
 </templateSetting>
 <templateSetting>
  <key>show_filmstrip_nav</key>
  <valueType>truefalse</valueType>
  <defaultValue>true</defaultValue>
 </templateSetting>
 <templateSetting>
  <key>enable_slideshow</key>
  <valueType>truefalse</valueType>
  <defaultValue>true</defaultValue>
 </templateSetting>
 <templateSetting>
  <key>autoplay</key>
  <valueType>truefalse</valueType>
  <defaultValue>false</defaultValue>
 </templateSetting>
 <templateSetting>
  <key>show_captions</key>
  <valueType>truefalse</valueType>
  <defaultValue>false</defaultValue>
 </templateSetting>
 <templateSetting>
  <key>filmstrip_size</key>
  <valueType>integer</valueType>
  <defaultValue>3</defaultValue>
 </templateSetting>
 <templateSetting>
  <key>filmstrip_style</key>
  <valueType>dropdown</valueType>
  <defaultValue>scroll</defaultValue>
  <values>
   <value>scroll</value>
   <value>showall</value>
  </values>
 </templateSetting>
 <templateSetting>
  <key>filmstrip_position</key>
  <valueType>dropdown</valueType>
  <defaultValue>bottom</defaultValue>
  <values>
   <value>bottom</value>
   <value>top</value>
   <value>left</value>
   <value>right</value>
  </values>
 </templateSetting>
 <templateSetting>
  <key>frame_width</key>
  <valueType>integer</valueType>
  <defaultValue>80</defaultValue>
 </templateSetting>
 <templateSetting>
  <key>frame_height</key>
  <valueType>integer</valueType>
  <defaultValue>40</defaultValue>
 </templateSetting>
 <templateSetting>
  <key>frame_opacity</key>
  <valueType>number</valueType>
  <defaultValue>0.4</defaultValue>
 </templateSetting>
 <templateSetting>
  <key>frame_scale</key>
  <valueType>dropdown</valueType>
  <defaultValue>crop</defaultValue>
  <values>
   <value>crop</value>
   <value>fit</value>
  </values>
 </templateSetting>
 <templateSetting>
  <key>frame_gap</key>
  <valueType>integer</valueType>
  <defaultValue>5</defaultValue>
 </templateSetting>
 <templateSetting>
  <key>show_infobar</key>
  <valueType>truefalse</valueType>
  <defaultValue>true</defaultValue>
 </templateSetting>
 <templateSetting>
  <key>infobar_opacity</key>
  <valueType>number</valueType>
  <defaultValue>1</defaultValue>
 </templateSetting>
</templateSettings>
